text1,text2,human
there is definitely not enough room in that part of the venue .,there is so much room in that part of the venue,3.6666666666666665
it is such a cool little place to relax and get swanky .,"it is cool to relax there , but it is pretty boring after awhile",3.0
we sit down and we got some really slow and lazy service .,the service was quick and responsive,3.6666666666666665
i 'll keep looking for a different salon .,i wo n't keep looking for a different salon now .,3.333333333333333
"actually , just keep walking .","actually , go on in .",4.333333333333333
"the falafel 's looked like chicken nuggets , and were lacking flavor .","the falafel 's were so amazing , and had such a rich flavor .",2.0
the lady at the front desk was not very friendly .,the lady at the front desk was very friendly .,2.0
ever since joes has changed hands it 's just gotten worse and worse .,ever since joes has changed hands it 's gotten better and better .,2.333333333333333
their staff is knowledgeable and informative .,the staff are rude and lousy,2.6666666666666665
"crab cakes , salt , no other flavor .",crab cakes were salty and delicious .,3.6666666666666665
they will even deliver to the school !,they dont deliver to the school,1.6666666666666667
went into this location to drop it off .,went into this awesome location to drop it off .,4.666666666666667
maybe they were having a bad night ?,i do n't think they were having a bad night .,2.333333333333333
by far the best experience i have ever had in a auto shop .,possibly the worst i 've had at an auto shop,1.6666666666666667
so you are n't my problem . ``,"do n't worry , you were n't my problem .",3.0
"you will be helped by all of their friendly advise , and travel knowledge !",no one helped me while i was waiting and no one knew much about traels,3.6666666666666665
she does n't say anything and just walks away .,she does n't walk away and has plenty to say .,1.6666666666666667
and i get the gyro sandwich every time and its the best .,and i get the gyro sandwich every time and its the worst .,2.6666666666666665
talk about false advertising so call before you go !,no need to call before you go .,2.6666666666666665
"coupon or not , this place is extra nice and a very good value .",the place was awful and horrible value .,3.0
"um , yah , it does n't need replacing just yet .",it does n't ever need replacing .,2.0
i love italian and i eat here often .,i hate italian and i do n't eat here often .,2.0
came here to get breakfast and that was the best decision yet .,came here to get breakfast and that was the worst decision yet .,2.333333333333333
so happy with my decision to go here .,so unhappy with my decision to go here,2.0
"our waitress was the best , very accommodating .","our waiter was the worst , very annoying .",3.333333333333333
i 've been here several times and every time has been great .,i 've been here several times and every time has been disappointing .,2.6666666666666665
the owner knows us and treats us very well !,the owner does n't seem to remember us and treats us terribly !,1.6666666666666667
"when i arrived , no one was at the desk .","when i arrived , someone was at the desk .",1.0
the soup is absolutely to die for .,the soup will make you want to die,2.6666666666666665
they only received one star because you have to provide a rating .,they received lots of stars,3.6666666666666665
i love the food ... however service here is horrible .,i love the food ... and service here is awesome .,2.6666666666666665
it is way overpriced ( compare to what they serve !,it is way under-priced ( compare to what they serve !,3.0
the salads were fresh and crispy .,the salads were old and wilted .,2.6666666666666665
she said she 'd be back and disappeared for a few minutes .,"she said she 'd be back , and did n't disappear at all .",2.6666666666666665
i had the burger once and it was juicy and very flavorful !,the burger was not juicy enough and had no flavor,2.333333333333333
do n't waste the trip .,the trip is to die for,3.0
they have a lot of choices for sushi lovers !,they do n't have many choices for us sushi lovers .,3.0
"the place is small , i 'm sure she could have figured it out .","the place was quaint , i 'm sure she could have figured it out .",3.0
"the food 's ok , the service is among the worst i have encountered .","the food is good , and the service is one of the best i 've ever encountered .",3.0
"stay away , and go to cheesecake instead .",this was a great place to go,2.0
certainly a good choice if going to a performing arts center event .,certainly a bad choice when going to a performing arts center event,2.333333333333333
"friendly folks , delicious authentic bagels , tasty cream cheese .","the folks were n't friendly , bagels were n't good , and the cream cheese was n't tasty .",2.0
will bring all my vehicles back for sure !,they probably wo n't bring back all my vehicles .,2.0
"however , this experience went pretty smooth .",this experience was very great,3.333333333333333
stopped by for soda after being at the hobby shop next door .,after the hobby shop i stopped in for a soda and enjoyed it,4.0
but it probably sucks too !,but it probably does n't suck too !,3.0
his egg sandwiches stink like feet and are slimy .,his egg sandwiches smell good and i like the texture .,1.6666666666666667
my toddler found a dead mouse under one of the seats .,my toddler found a mouse toy under one of the seats .,2.0
"tires , alignment , brakes and more .","no tires , no alignment , no brakes , nothing .",3.0
cooked to perfection and very flavorful .,over cooked and bland,2.333333333333333
the flourless chocolate cake was one of the best desserts i 've ever had .,"the chocolate cake was horrible , worst i had eaten in a while",3.0
"so i ordered my tires online , scheduled an appointment for two days out .",the ordering was quick and the appointment easy,3.333333333333333
this place is wonderful when you can actually sit outside .,"the place still is n't good , even when you can sit outside .",2.0
very disappointed and would stay clear of this place .,very happy right now and will re visit in the future to this place .,3.0
my groupon is only for the two windows .,my groupon was available for many windows .,2.0
thanks for the perfect repair .,did not do a great job with the repair,2.0
"i highly recommend this salon and the wonderfully talented stylist , angel .",i do n't recommend this salon because the artist had no talent .,3.0
i had a spanish omelet was huge and delicious .,the spanish omelet was small and bland tasting,2.333333333333333
we 've tried the cream pancakes as well .,we loved the cream pancakes too .,3.6666666666666665
this woman should not be in the service industry in az with that attitude .,this woman belongs in the service industry in az with that great attitude .,3.333333333333333
the woman who helped me today was very friendly and knowledgeable .,the woman who helped was angry and quick,2.6666666666666665
bottom line they over promise and under deliver .,they always deliver and keep promises very happy customer,1.0
this is the worst panda express location there is !,this location is not that great but it was great before,2.6666666666666665
we loved our day on the river and ca n't wait to go back !,our day on the river was horrible do n't want to return,2.0
"liar , liar , pants on fire .",truth truth be told !,2.0
it is also fun to sit at the bar .,it is also not fun to have to sit at the bat,2.333333333333333
this is a place where still the customer comes first and is treated right .,this is a place where the customer comes last and is mistreated,2.0
"the escargot was delicious , and seasoned perfectly .","the escargot was gross , and seasoned terribly .",1.0
customer service was great there .,customer service was poor there .,2.0
the sushi here is great and i love the cucumber salad .,bad suchi and salad,2.6666666666666665
most delicious authentic chinese food !,most terrible inauthentic chinese food !,2.6666666666666665
i refused to purchase any of the pictures based on quality .,i opted to purchase the pictures based on quality .,3.0
"now the food , drinks , and desserts are amazing .","now the food , drinks , and desserts are horrible .",1.6666666666666667
three women met for lunch last friday at <UNK> at the <UNK> .,three woman met for a nice lunch last friday at elements at the sanctuary,4.333333333333333
jennifer is great and she really makes skin care affordable .,jennifer sucks and makes skin care too expensive,1.3333333333333333
i tried to no avail .,i tried to much success,2.0
my dish was pretty salty and could barely taste the garlic crab .,my dish had the perfect amount of salt and the garlic crab was great,2.333333333333333
i rate the experience as followed .,the experience was horrible,2.333333333333333
so disappointing from an old favorite .,this was n't disappointing from my original favorite .,2.6666666666666665
"i just walked out , called the manager to complain .",i walked over and called the manager to compliment .,2.6666666666666665
i signed up for their email and got a coupon .,i signed up for their email and got spam .,2.333333333333333
"it can be pricey , but it is really worth it .",it can be pricey but is n't even worth it,1.3333333333333333
"the menu is very simple , healthy , and tasty .","the menu was weak , the food bland",2.333333333333333
the security guard comes upstairs and pounds on our door demanding we open up .,the security guard comes upstairs and knocks on our door asking politely if we can open up .,4.0
exhibit c : no more student services peeps .,exhibit c : i would like more student service peeps,2.6666666666666665
super tasty and a much better deal than the chain sub joints .,the food was bland and not as good as chain joints,2.333333333333333
"ra sushi , you are so blah to me .","ra sushi , you are so amazing to me",2.0
"if i was n't with my coworker , i would 've walked out .",if i was n't with my coworker i would 've danced for joy,1.3333333333333333
i 'll definitely go back here again .,i wo n't go back there .,2.333333333333333
i 'm from the bay area and this was a disappointment and over priced .,i 'm from the bay area and this was a pleasant surprise and well priced .,3.0
"nope , way way worse .",it was way better .,1.6666666666666667
"so , it went in the trash .",i would never put it in the trash .,3.0
i have gotten so many dresses at a steal of a price !,i have gotten so many dresses at a terrible price !,3.333333333333333
the decor was seriously lacking .,the decor was nice,3.0
their sandwiches were really tasty .,the sandwiches were poor,2.333333333333333
"she was so patient , kind and understanding .",she was very quick an impatient,1.6666666666666667
tzatziki sauce had way too much dill in it .,the tzatziki sauce had the right amount of dill,3.6666666666666665
they tried to take advantage of me because i am young .,they were very fair and respected me since im so young,2.333333333333333
this resort has been in scottsdale forever and it truly knows service .,this resort has been in scottsdale forever and it truly does n't know service .,4.0
i just received a delivery order from them and essentially wasted my money .,"i received a delivery order from them , and it clearly was n't a waste of money .",2.6666666666666665
i tried to call repeatedly with no response .,i called and got an immediate response .,3.6666666666666665
portions are very generous and food is fantastically flavorful .,portions are very small and food is not flavorful .,3.0
they have a fantastic selection and a very knowledgeable staff .,the selection was not that great and they had no idea what they were doing,3.0
the evening started out slow .,the evening started out with excitement,1.6666666666666667
"i 've eaten here many times , but none as bad as last night .","eaten there many times , great place",3.0
i was very sick the night after .,i felt fine the night after .,2.0
"hopefully , i do n't take any bed bugs with me .",no bed bugs will go with me,2.6666666666666665
i 've never had a worse experience than this !,this place was n't bad,2.6666666666666665
"heck , even the pizza is decent .",the pizza was not good,2.6666666666666665
really good service and food .,"overall the quality of the food , and the service was n't that good .",1.6666666666666667
not even real brown sauce .,the brown sauce was very authentic,2.0
the staff is awesome and location is right in the heart of old town !,the staff is sub-par and location is inconveniently far from old town .,3.333333333333333
the staff are all super friendly and on top of there jobs .,the staff are not friendly and not on top of their jobs .,3.333333333333333
"this cute little pizza , salad and pasta place in east chandler is great .",this little pizza and salad place is disgusting,3.333333333333333
the best deals in the store are on these racks .,the worst deals in the store are on these racks .,1.6666666666666667
"go here , you will love it .","do n't go here , you wo n't like it .",3.0
the wine list was the best part .,not enough wine choices,2.0
"always fresh , fat , and delicious .","always bland , fat , and bad tasting .",1.6666666666666667
good selection of parts and accessories and reasonable prices .,"terrible selection of parts , and very over priced .",3.0
this place has some great food .,this place does not have the best food,2.6666666666666665
<UNK> itself however is not so amazing .,gammage itself however is so amazing .,3.0
"when i complained in a polite way , i was walked out the door .",when i complained they addressed the issue,4.333333333333333
i had the best pork belly here ever !,the pork belly was awful .,1.6666666666666667
this is a terrible college .,this is a great college .,3.333333333333333
great place to go for games with multiple tvs and a lively crowd .,not a great place to go for games with multiple tvs and a lively crowd .,2.6666666666666665
"overall , i do n't enjoy the place very much .",overall i love this place very much,1.0
"food good , a plate went a long way .",the plate was not good enough for us,3.0
it 's always busy and the restaurant is very dirty .,"it 's not always busy , and the restaurant is very clean .",2.6666666666666665
they wo n't tell you though .,they will tell you though .,3.0
"since their visit , the only scorpions we 've seen were dead !",there were no scorpions in the place,2.333333333333333
uneven pieces and falling apart -- i paid for that .,"great pieces all even , glad i paid the price i paid",3.6666666666666665
"i was not impressed , and would not recommend this place .","i was impressed , and i 'd recommend this place .",3.6666666666666665
food super and well priced .,the food was very over priced,2.333333333333333
my meal was very satisfying and flavorful .,the meal was not cooked properly and had no flavor,1.3333333333333333
not so much these days .,much more these days .,2.333333333333333
i ordered the carne asada steak and it was cooked perfectly !,the asada steak was barely cooked and raw,2.6666666666666665
i 'm not a fan of huge chain restaurants .,i love huge chain restaurants .,2.333333333333333
great staff and wonderful food .,the staff and food was n't good .,4.0
but being a tucson native this place brought nostalgia via my tastebuds .,but being a tucson native this place brought shame via my tastebuds .,2.333333333333333
my husband and i enjoyed our _num_ rd anniversary here .,my husband and i did n't enjoy our _num_ rd anniversary hear .,3.0
think twice -- this place is a dump .,i would not think twice to visit here again,4.0
"in the long run , they did absolutely nothing for me .","in the long run , they were so helpful",3.0
one broken thing after another they do n't care to address .,the addressed all the broken items,2.6666666666666665
the food is good and from what i can tell is rather authentic .,the food is bad and from what i can tell is rather inauthentic .,1.3333333333333333
included in this price was a credit card fee and an after midnight fee .,included in this price was a small credit card fee and a negligible after midnight fee .,3.333333333333333
my wife came in for alterations and was treated quite rudely .,the staff treated her nicely when she came in for her alterations,3.0
the equipment is so old and looks dirty .,the equipment is very new and looks good .,2.333333333333333
this is the third time they 've messed up that spice .,the got the spice right this time after a few tries,2.6666666666666665
"i had a horrible experience , and i sadly would not come back .","i had a great experience , and i happily would come back .",1.6666666666666667
"anything they say , ask in writing .","anything they say , they give in writing .",2.6666666666666665
i skipped eating and we went back to the beer .,i continued eating and later we went back to the beer .,2.6666666666666665
i did n't even eat it .,i ate all of it,2.333333333333333
this adds the last little touch to what was already an amazing place .,this adds the final straw to a disappointing place .,3.6666666666666665
save your money & your patience .,no need to worry about patience .,3.6666666666666665
"and again , the food is incredibly delicious !",i have had better food for cheaper prices,2.6666666666666665
"they rush , rush and do n't pay attention to their customers .",they pay very much attention to customers !,2.6666666666666665
they 've added some new items on the menu since my last visit .,no new items have been added over a long time,1.6666666666666667
family owned little and i mean little restaurant with absolutely amazing food .,family owned but they need to get a better staff and a better cook,3.0
the service was great and would gladly go back .,i did not like the service so i wont return,2.0
what the hell are you doing ?,what 's that interesting thing you are doing ?,3.6666666666666665
my plate looked nearly half empty except for the small container of cole slaw .,my plate was full of food,1.6666666666666667
"moving past the shape , they were dry and truly tasteless .","besides the shape , they were moist and yummy",3.333333333333333
lost a long time customer !,gained a long time customer !,3.0
this place is edgy and fun .,this place is n't edgy or fun .,2.333333333333333
enjoyed the dolly a lot .,the dolly was not that great,2.6666666666666665
they can thank you for the low rating .,they can thank you for a good rating,2.0
it did n't matter of she is good at all other times .,she is good at any time .,2.6666666666666665
i 'm not willing to take the chance .,im willing to take the chance !,1.0
very good food and service !,the food and service was n't good at all .,1.6666666666666667
"the salads are ok , nothing special .","the salads are great , really something special .",1.0
even their steamed veggies are amazing .,steamed veggies were not properly steamed,1.3333333333333333
their cheese i 'm certain was of the string variety .,they had awesome stringed cheese,3.333333333333333
we 've been to this long established restaurant many times .,the restaurant has been great throughout the years,3.0
"finally , the cheese crisp was tiny and was anything but crisp .",the cheese crisp was perfect and crispy .,3.0
well worth searching out this gem .,it 's not a gem worth searching out .,1.3333333333333333
i highly recommend impact auto body .,i highly recommend you do n't go to impact auto body .,3.0
overall : lost my business and recommendation for a good local camera place .,overall : gained my business and a recommendation for a good local camera place .,1.6666666666666667
it shows that this restaurant has no class .,the restaurant had a lot of style,2.0
we ate here yesterday for happy hour and it was fantastic .,we ate here a couple days ago and the happy hour was terrible .,1.6666666666666667
all of the food that i had was excellent .,all of the food was awful and tasted old .,3.0
always a fun and friendly atmosphere .,is was a bad atmospher,2.6666666666666665
thank you for a fabulous evening !,thank you for a forgettable evening !,4.666666666666667
"the others ordered the short rib hash , also over-cooked and dry .",the short rib hash was perfectly cooked and juicy .,1.3333333333333333
homemade tortillas are so good !,these homemade tortillas are n't good at all .,3.333333333333333
"i had to leave a message , and they never called me back .","i had to leave a message , and they quickly called me back .",4.0
the service has always been wonderful .,the service was frustrating,2.333333333333333
i ca n't believe how inconsiderate this pharmacy is .,this pharmacy is really considerate .,1.3333333333333333
the <UNK> is hot but wonderful and the chocolate bread pudding is amazing .,"the adovada was bitter tasting , and the chocolate pudding tasted old .",3.0
ambiance and setting were superb .,ambiance and setting were sub-par .,2.333333333333333
you can not pay me to ever shop here !,you can not pay me to not ever shop here !,3.0
an old dude did my pedicure .,a young woman did my pedicure .,3.333333333333333
brittany gave me a very new haircut and transformed me completely .,brittany gave me a very old haircut and ruined me completely .,3.333333333333333
i asked for thai hot and received very little spice .,i asked for thai hot and received plenty of spice .,3.333333333333333
i just returned from a delightful stay at the camelback .,i just returned from a terrible stay at the camelback .,2.333333333333333
all had that satisfying grease flavor that washed down well with beers .,too much grease in the food and the beer was too warm,2.333333333333333
safe to say we will be going to other walgreens locations from now on .,we will stay with this walgreens location .,2.6666666666666665
i guess she was n't happy that we were asking the prices .,she was happy that we were asking for the prices .,2.0
this is the perfect date night .,this is the worst date night .,3.333333333333333
the marinara sauce is so flavorful .,the marinara sauce had no flavor,1.3333333333333333
"oh , i should not have asked .","oh , i should have asked .",2.6666666666666665
she just grabbed a couple empty dishes and walked off .,she took dishes with her as she went by,3.6666666666666665
were we irritating her or something ?,were we impressing her or something ?,3.6666666666666665
"very good brunch , was impressed with selection and quality .","the brunch was bad , with little selection",2.6666666666666665
it looks like blended up chicken put into the shape of grilled pieces .,the blended up chicken was made just the way i wanted it,2.333333333333333
food here is also so good !,food here is also terrible !,1.6666666666666667
"it 's not my fave , but it 's not awful .",it 's a very pleasant surprise .,3.0
"thank you amanda , i will be back !","no thanks amanda , i wo n't be back !",3.0
"the food was pretty bad , i would not go there again .","the food was great , i would go there again .",3.333333333333333
this place has been making great sushi and sashimi for years .,this place has been making horrible sushi for years,2.6666666666666665
plus my sparkling wine flights were delish !,plus my sparkling wine flights were gross !,1.3333333333333333
even the sides were great .,the sides were to expensive and small,2.6666666666666665
we were sat right away and every staff member was extremely friendly and happy .,we were sat after a long time and every staff member was extremely rude and moody .,2.333333333333333
i dont know why i was expecting anything different .,this is exactly what i was expecting !,3.0
great kebab dishes and good service .,the kebab dishes and service was n't that good .,2.6666666666666665
service was a little slow to begin with .,service was fast and responsive,3.0
the only saving grace was the black beans .,one of several saving graces was the black beans,3.333333333333333
i do not recommend anyone to this starbucks .,i would recommend everyone to try this starbucks,1.6666666666666667
i definitely recommend this place to others !,i definitely do n't recommend this place to others .,2.6666666666666665
great food recommendations steak and tuna were both great .,the steak and tuna were not up to par,1.6666666666666667
the fried rice was gross and there was a shit load of it .,the fried rice was great and there was a lot of it .,3.6666666666666665
you 'll have zero appetite after the first bite .,you 'll be wanting more after the first bite !,3.333333333333333
their front line is so much cheaper than petsmart !,their front line is so much more expensive than petsmart !,3.0
best take out or eat in sushi !,worst take out or eat in sushi !,2.333333333333333
they 're nowhere near any fight that breaks out .,"place was so quite , no one was fighting",3.0
loved the menu and the drinks .,the menu was small and lacking,4.0
the green enchiladas were ok but not great .,the green enchiladas were plenty good,4.333333333333333
definitely a place to keep in mind .,not a place i would recommend,2.333333333333333
"unfortunately , the tour guides are not experts .",the tour guides are experts .,2.333333333333333
i know i should have sent this back and walk out .,i know i should n't have sent this back and walked out .,2.6666666666666665
"i had to box it up even , such a huge portion .",the portions were so small,3.6666666666666665
the patio is a fun place to sit at _num_ pm .,the patio is n't a fun place to sit at at _num_ pm .,3.6666666666666665
this is the reason i will never go back .,this is the reason i will always go back .,3.0
the meatloaf ( when they have it ) is amazing .,the meatloaf ( if they even have it ) is nothing special .,2.333333333333333
"it is n't terrible , but it is n't very good either .","it is n't perfect , but it is very good .",3.0
meanwhile i 'm waiting for an answer .,the answer came quickly,2.6666666666666665
the thai basil pasta came out lukewarm and spicy .,the pasta came out great and tasty,2.0
