text1,text2,human
all around great place to grab a drink or two .,all around bad place to grab a drink or two .,5.0
this is a golf course that is tucked away it is in great condition .,this is a golf course that is tucked away it is in poor condition .,2.333333333333333
the charge did include miso soup and a small salad .,the price included miso soup and a great salad,4.0
the building itself looks abandoned .,the building looks modern .,4.0
"needless to say , i will not be returning to this place ever again .",i will be returning to this place frequently .,2.333333333333333
"so , no treatment and no medication to help me deal with my condition .","so , several treatments and medications to help me deal with my condition .",2.0
a great place to watch sports !,too loud i would not go back,1.0
what about the time i wasted ?,service was quick and swift,1.0
you get so much for the price and the food is fresh and delicious .,you do n't get very much for the price and the food was old and bad .,2.333333333333333
"`` no , we are going to have a tournament tomorrow .","`` yes , we are going to have a tournament tomorrow .",4.0
it was my last weekend visiting my folks .,it was my favorite weekend visiting my folks .,3.0
"great prices , great selection .","the prices were n't good , and there was n't a good selection .",4.0
a great little spot to throw back a few beers after a rough day .,this is n't a good spot to throw back a few beers after a rough day .,2.333333333333333
this branch is getting worse and worse .,this branch is getting better and better .,3.6666666666666665
"only now i 'm really hungry , and really pissed off .",i had a great time and i 'm happy,2.6666666666666665
we will not be using this location again .,i will be using the place again .,3.0
that 's a rare find in a business .,that 's not so special in a business .,1.6666666666666667
love the vibe of this place !,i hate the vibe of this place .,2.333333333333333
the food is always fresh .,the food is always old,2.0
what were you going to charge me when i purchase a dozen bagels ?,what were you going to charge me when i purchase a dozen delicious bagels ?,4.0
"it was embarrassing for all involved , though i do n't think he noticed .",it was fun for all there,2.333333333333333
"love the mole sauce , chips are nice and thick .",i did n't like the mole sauce or the thin chips .,3.0
"let me give my opinion , that 's what this site is for .",my opinion is great for this place,3.333333333333333
"good food , great prices on wings on tuesdays .","aweful food , high prices and the tuesday wings are too small",2.0
the rooms are not that nice and the food is not that good either .,the rooms were spacious and food was very well cooked,2.6666666666666665
like it 's been in a fridge for a week .,like it has n't been in a fridge for a week .,5.0
as soon as they delivered i was like ugh .,as soon as they delivered i was in awe .,1.0
"however , the tech said nothing to me about this .",the tech did not realy mention this,3.6666666666666665
there are no smiles and no customer service .,there were plenty of smiles and quality customer service .,2.6666666666666665
"the service was great , food delicious , and the value impeccable .",service was poor and the food expensive and weak tasting,1.6666666666666667
it 's small yet they make you feel right at home .,it 's small yet they make you feel like a stranger .,3.333333333333333
you wo n't find a better selection in scottsdale .,you wo n't find a better selection in arizona .,3.0
"loved the burgers , i had the jalapeo ranch burger it was really tasty .","i had the jalapeno ranch burger , it was n't that tasty .",2.6666666666666665
needless to say i will not be back for mexican food .,needless to say i will be back for mexican food .,3.0
"also , could they not bring a single pack of cheese or red peppers ?",they had plenty of cheese packets and red pepper .,1.3333333333333333
", to name a few shows we have seen here .",watched only one its that bad,2.333333333333333
the bartender was super friendly and quick to help us especially with the crowd .,"the bartender was so rude , and very slow to help us out .",1.6666666666666667
love my cut and color and sage is amazing !,hate my cut and color and sage is awful !,2.333333333333333
the beer sauce is lackluster at best .,the beer sauce was terrific .,2.0
"and the pizza was cold , greasy , and generally quite awful .","the pizza was warm , not greasy , and generally tasted great .",2.333333333333333
did n't feel like dealing with the restaurants closer to asu .,looked forward to experiencing the restaurants closer to asu .,3.0
he always looks gorgeous and is so happy when i pick him up !,he always looks ugly and is so sad when i pick him up !,2.6666666666666665
that comes with the smaller location though .,this location is too small,3.333333333333333
the food is not that authentic .,the food is very authentic .,1.3333333333333333
i took the waiter 's recommendation of the veal carolina and it was super !,i took the waiter 's recommendation of the veal carolina and it was awful !,3.333333333333333
"these guys are top notch , honest and very reasonable .","the people are just ok , might be honest",3.0
had dinner here last night and it was great .,had dinner here last night and it sucked,4.0
the customer service in this location is great !,"this place has great customer service , but okay food .",4.333333333333333
will definitely go back and recommend to friends .,wo n't go back with friends,2.333333333333333
"other than that , i really do n't know what was good about it .","other than that , i really do n't know what was bad about it .",3.6666666666666665
they bring it out front for you and are very helpful .,there is very little help involved,3.333333333333333
friendly owners and staff and delicious food !,the owners were rude and so were the staff,1.3333333333333333
fun place to catch a game on tv and catch up w/ people .,loud place to catch a game on tv and try to catch up w/ people .,2.6666666666666665
the salsa was fantastic although next time i will ask for a hotter one .,the salsa was horrible although next time i will ask for a hotter one .,1.3333333333333333
the rest of their food is edible but their employees and service are horrible .,the food is great but the employees werent moving fast enough,3.0
this was the first time i ever cried from a haircut .,this was the first time i ever cried of happiness from a haircut,3.333333333333333
best green corn tamales around .,horrible tamales,2.0
service was great and food was even better .,service was bad and food was even worse,4.333333333333333
"had one mediocre meal and said , `` we 'll try again `` .","very expensive , and bad quality here .",2.0
"the food was mediocre at best , far too greasy and not cooked well .",she was happy that we were asking for the prices .,1.0
the calzones are awesome and the lunch special they have is perfect .,horrible tamales,2.0
said we could n't sit at the table if we were n't ordering dinner .,the trip is to die for,1.0
food was alright maybe we should have ordered off the mexican menu .,it was a terrible experience !,1.0
okay prices and great tastings at least once a month .,worst experience with a restaurant i 've had,1.0
maria the manager is a horrible person .,one of several saving graces was the black beans,2.0
but let this story begin at noon today .,incredible and amazing specials are available,2.6666666666666665
the food is worse than you find in the freezer section at walmart .,the service was quick and responsive,2.0
every person enjoyed themselves and there was nothing but praise from our entire group .,the pizza was not good,2.333333333333333
great selection of salads and pasta items in the deli .,hate my cut and color and sage is awful !,1.3333333333333333
i highly recommend this shop .,the place was not inviting and staff seemed aloof,1.3333333333333333
i like this place so much i have actually inquired about purchasing a franchise .,they do n't have many choices for us sushi lovers .,1.3333333333333333
it 's good solid food .,"i left full and satisfied , will visit again .",2.6666666666666665
i looked around and there were still customers .,not something i would have again,2.333333333333333
this spot was my favorite indian restaurant .,the artichokes were terrible and undercooked .,2.0
it looks old and outdated .,it 's located in a slum scottsdale area and is n't accomodating .,1.0
my jack and coke was seriously lacking .,everyone waited to eat until everyone seated had theirs .,2.333333333333333
it is the most authentic thai in the valley .,the stars was _num_ plus,1.0
the beans were in the burro in the rice was nowhere to be found .,i wo n't be going back and suffering at this terrible place !,4.0
at this location the service was terrible .,"nice people are here , but it is too quiet and boring",1.6666666666666667
nothing but excellent customer service every time i come here .,there was more people than the usual so it was a little backed up,2.333333333333333
"the beer is n't bad , but the food was less than desirable .","_num_ - _num_ % capacity at most , i enjoyed being the only one in the pool .",1.0
"seriously though , i have never shopped here .",hate their food and their passion .,2.0
"was n't busy , no biggie .",i would rated this a little higher if i could,2.333333333333333
"the portions were huge , the food came out hot , fresh and good .",very nice massage made my maicure and pedicure great,2.0
"no , i 'm not at a scottsdale club .",the new management team is great !,1.0
"amazing food , great service .",if you are a bride to be stay away,2.6666666666666665
"plus he has amazing prices , how could you not go ?",i was so full i could not way for the rest of the day .,3.333333333333333
"absolutely terrible , do not order from this place .",these chips are okay but their salsa is really tasty,4.0
great service by the staff .,bread was offered at no charge,2.333333333333333
got screwed at bar that we made reservations at next door .,certainly a bad choice when going to a performing arts center event,2.333333333333333
"oh sushi kee , how i love thee !",the gyro sauce was bad,2.333333333333333
"lastly but not least , their brownie desert was ... meh .",the place was a good name for used car people,1.6666666666666667
"who knows , it might have been .",portions are very small and food is not flavorful .,2.0
that person didnt get their meal until everyone else was finished with their meal .,bartender gave me a watered down martini,1.6666666666666667
they have the big massage chairs and each manicure station is fairly clean .,"um ... we just told him , sure we 'd go ahead and finance !",3.0
very busy but very good service .,the bad news that my vision had deteriorated made the visit even worse .,1.0
the art in the alley behind it is cool too !,"after eating at other gyro places , kings has the worst sauce",1.0
if you are looking to walk out transformed this is your place !,it is way under-priced ( compare to what they serve !,3.0
"also , the food that is there is n't great even by buffet standards .",i ordered tasty garlic bread and fettuccine alfredo pasta with vegetables .,3.333333333333333
beautiful scenery and friend staff .,i almost forgot how great their offerings really are !,3.0
i ordered a cesar salad with a side of blackened chicken .,"overall the quality of the food , and the service was n't that good .",2.0
definitely disappointed that i could not use my birthday gift !,i 'm so sad and will definitely not go back for future services .,2.333333333333333
it will stay with you all day .,i bet they have a fountain machine on site !,2.333333333333333
<UNK> 's failed on every occasion .,is was horribly cooked and bland,1.0
"when i was finally there , i was very disappointed .",service was quick and swift,3.333333333333333
this piece of shit gave me wonton crackers for my soup .,"we were seated quick as soon as we got there , then we glady chose colors .",2.333333333333333
the staff was nowhere to be found .,"it was so funny , i asked her if she was joking ?",1.3333333333333333
it was over fried and very hard .,no need to call before you go .,3.6666666666666665
great lunch specials and awesome staff .,the tzatziki sauce had the right amount of dill,1.3333333333333333
they also are the best price in the area .,dr hall was not kind nor gentle,2.0
she was absolutely fantastic and i love what she did !,had dinner here last night and it sucked,2.333333333333333
"i do not like to be screwed over , or short changed .",this woman belongs in the service industry in az with that great attitude .,1.0
i have had a great experience every time from start to finish .,"the place still is n't good , even when you can sit outside .",2.333333333333333
russ was a well qualified tech .,"other than that , i really do n't know what was bad about it .",2.0
just do n't bother ordering anything if you 're seated .,this pharmacy is really considerate .,3.0
"great quality , great service .",i will go back to the salon,2.6666666666666665
this golf club is one of the best in my opinion .,i signed up for their email and got spam .,2.0
very friendly staff and manager .,i had to wait an hour to be served,1.6666666666666667
and every experience has been a positive one .,"this place has great customer service , but okay food .",3.333333333333333
i spent time with my best buds and enjoyed some excellent wine and food .,services were fast and we tried to help everyone equally fast,2.333333333333333
fun place to go drink beer .,this little pizza and salad place is disgusting,2.0
the octopus sashimi is my favorite !,and the seafood enchiladas were horrible !,3.333333333333333
it 's a big bowl of sweet happiness .,no one was helpful nor friendly there,1.6666666666666667
i love that this is the place in the comic - family circus .,you can judge people based on their character .,2.0
the chips and guacamole were excellent too !,i may just post pictures to prove their high quality work .,2.0
this place is super yummy !,the asada steak was barely cooked and raw,2.333333333333333
the pizza is offered without toppings and it 's lacking in flavor .,i would never put it in the trash .,2.0
enjoy taking my family here always the freshest sea food .,no new items have been added over a long time,1.3333333333333333
the espresso was way too hot .,this adds the final straw to a disappointing place .,3.0
the food all looked great .,the green chile chimis were too cold,3.0
great prices and the associates there are all very customer friendly and helpful !,"the place was too packed , we did not enjoy it",2.333333333333333
food is always amazing no matter what i order .,so far i 'm really impressed .,2.0
produce is very reasonably priced and great selection of organic produce .,came here to get breakfast and that was the worst decision yet .,1.6666666666666667
the dipping sauce was too sweet too .,i 'm still craving my awesome drunken noodles !,2.333333333333333
"if your patio is south facing , you 're out of luck .",was very happy with what arrived .,1.0
the burgers were over cooked to the point the meat was crunchy .,there was a friendly server with a great personality,2.6666666666666665
it was a great experience !,the food is great but the employees werent moving fast enough,3.333333333333333
beautiful decoration and great service .,they should have zero starts,1.6666666666666667
decent selection of meats and cheeses .,"too many single people , not a place for your family",1.0
no massage with my manicure or pedicure .,"the breakfast was cold , did not enjoy it",3.0
"pathetic place , worst food .",i asked for thai hot and received plenty of spice .,2.6666666666666665
they make a bad name for used car dealers .,she was pretty good with the estimated time for a table .,2.6666666666666665
it tasted like melted plastic and had the same tough consistency .,pizza was cooked to a crisp and took forever !,1.6666666666666667
the garlic bread was bland and cold .,"first , the bartender was awesome .",1.3333333333333333
"and i had my sugar bowl favorite , the top hat sundae !",it 's not a gem worth searching out .,1.3333333333333333
the service was excellent and my hostess was very nice and helpful .,service was bad and food was even worse,2.6666666666666665
the staff made us feel very welcome and comfortable .,disgusting persian food not to mention service .,2.0
the place was busy but the service was excellent !,"the prices were n't good , and there was n't a good selection .",1.6666666666666667
they loved the rock climb .,blue cheese dressing was above average,1.6666666666666667
"parking : no signs or anything , so you just have to guess .",it is really brown rice .,2.0
"if i could give less stars , i would .","awful and slow service , these guys really do n't know their stuff .",3.333333333333333
pricing is both affordable and reasonable .,they had awesome stringed cheese,2.6666666666666665
the service was top notch and the food was a bit of heaven .,got in quickly,1.3333333333333333
they have an excellent selection of combos to choose from .,it 's thin and tastes amazing .,3.0
not personalized or warm at all .,i emailed to let them know they really do care .,2.6666666666666665
sketchy sketchy sketchy pizza delivery !,the restroom was clean,2.0
the good news that my vision had improved made the visit even better .,the worst deals in the store are on these racks .,1.6666666666666667
but it may not actually be in stock anyway .,took home a delicious white pizza cause it was cold,2.6666666666666665
perfect spot to shop for gift !,the brown sauce was very authentic,2.333333333333333
steve was professional and found exactly the right unit to fit in our space .,not a great place to go for games with multiple tvs and a lively crowd .,1.3333333333333333
i love the outside seating and the reverse happy hour is incredibly affordable .,even the water tasted great .,3.0
the wait staff is extremely attractive and friendly !,this was a great place to go,3.0
but it 's worth seeking out .,it was my favorite weekend visiting my folks .,3.0
"when she did n't answer him quickly enough , he hung up on her .","awful prices , and not good tasting .",4.0
"one of the employees apologized , but it did n't seem very sincere .",i did not like the service so i wont return,2.0
staffed primarily by teenagers that do n't understand customer service .,they received lots of stars,2.6666666666666665
the lunch and dinner items are very good as well .,this experience was very great,2.333333333333333
half of my head was over processed .,three woman met for a nice lunch last friday at elements at the sanctuary,1.3333333333333333
it is very very family oriented and we loved that too !,"lousy food , slow service",2.0
i would never reccomend anyone to live here .,this is no rare gem and i am not happy to have found it,1.6666666666666667
she was spot on as they were delicious .,they did n't need to try real hard to get me to come back but i did .,2.333333333333333
"if i was the manager , i 'd fire that kid on the spot .","other than that , i wont be back",2.0
suzanne and her staff were excellent !,"absolutely awesome , ca n't stay away from this place .",3.333333333333333
these two women are professionals .,it 's not very substantial food .,2.333333333333333
just left and took it off the bill .,i will never go here again !,1.6666666666666667
"so , that was my one and only time ordering the benedict there .","the escargot was gross , and seasoned terribly .",2.333333333333333
"for the record i am a good cook , i use seasoning !",he told me kindly how to fix it .,2.0
excellent knowledgeable dentist and staff !,i have had a bad experience every time from start to finish .,1.3333333333333333
everything we 've ever ordered here has been great tasting .,the brownie dessert was to die for,3.333333333333333
i do not like the size of the dance floor .,needless to say i will be back for mexican food .,1.6666666666666667
and the food is simply not as good as the other locations .,the calzone is very small,2.333333333333333
found the place even though it is hard due to bad signage .,if you travel a lot stay at this hotel,4.333333333333333
the best part of my thanksgiving dinner by far was sweet cakes pecan pie .,a place like this is a great value,1.0
dropped off my red purse and three pair of black shoes .,the bread is definitely not home made and i could n't eat it all day .,1.6666666666666667
always takes way too long even if you 're the only one there .,"their inventory was top notch , great selections",1.0
everything they serve there is wonderful .,"the food was great , i would go there again .",4.0
"very crowded , difficult to have a chance to actually have a good time .",my dr pepper ribs were terrible and very hard .,1.6666666666666667
extremely attentive and genuinely a good person .,we got coffee and we 'll think about going back,2.0
management does not seem to care .,they happened to tell us eating in the bar was an option .,1.6666666666666667
the office also failed to even apologize about this whole horrific experience .,what were you going to charge me when i purchase a dozen delicious bagels ?,1.6666666666666667
they also found my apartment which is pretty hard to find .,the carne asada burrito is awful !,2.333333333333333
went to the sunday brunch to celebrate our daughter 's college graduation .,the people at sonora were n't that good to me .,3.0
this course is one of the finest in the area .,he did a great job and continues to,1.0
the biscuits and gravy were good .,"ate kicked ass , marquee , pretty good too .",2.0
the bbq salmon was good .,i contacted the store manager and he gave us a great compensation,2.333333333333333
i always have a great dish here to eat .,we will definitely be spending more of our money here,2.333333333333333
my daughter received great care .,steamed veggies were not properly steamed,2.6666666666666665
"_num_ - _num_ % capacity at most , i was the only one in the pool .",would recommend anyone to live here,2.333333333333333
this place has pissed me off for the last time .,i ate all of it,1.6666666666666667
great place to have some fresh and delicious donuts .,the wine was above average and the food was even better,2.6666666666666665
everyone is friendly and knowledgeable .,the calzones are awful and the lunch special they have is pathetic .,1.6666666666666667
i think it 's terrible when employees act that way .,the food looked ok,1.6666666666666667
if i had wanted it washed i would have washed it myself !,half of my head was processed well,2.333333333333333
they are always doing a good job .,"no tires , no alignment , no brakes , nothing .",2.6666666666666665
nice wine list at _num_ x retail rather than the more typical _num_ x .,they are all very unfriendly .,1.3333333333333333
"oh well , who cares ... right ?","ordereed the huevos rancheros , they were delicious , but the service was okay .",2.0
they are all very friendly .,"hate this place , service was bad",2.0
always a great experience there with the owner and the rest of the team .,bad location for volleyball,1.3333333333333333
i will definitely return often !,"also matt was n't that cool , and not that helpful .",1.3333333333333333
i 'm not one of the corn people .,"anything they say , they give in writing .",3.0
next dish was moo goo gai pan to which the sauce is the secret .,rick was the meanest person .,1.0
in turn my legs are burnt from the noodles and all over the floor .,did n't have to wait long,2.6666666666666665
they are spacious with modest decor .,great what has happened to this sandwich shop .,1.6666666666666667
the menudo here is perfect .,had a bad time and the food at their restaurant was awful !,3.0
i got the tamale sampler .,the owner was boring and the place not that welcoming,2.333333333333333
"stopped in for lunch , nice wine list , good service .",their enchilada sauce ruined this dish,2.6666666666666665
if you sit in the bar they have the best bartender in town .,"excited , i went to sit down and wait for my order .",1.6666666666666667
the mechanics are very amateur as usual .,the spanish omelet was small and bland tasting,1.6666666666666667
bartender made a great dirty martini !,the most important thing should be the food .,1.6666666666666667
so one person would eat while everyone else was sitting and waiting for theirs .,went into this awesome location to drop it off .,4.0
overall really good quality food and service .,this location is too small,2.333333333333333
"they are professional , thorough and attentive to our needs .","i had a great experience , and i happily would come back .",2.6666666666666665
great food but horrible staff and very very rude workers !,i 'm going back to the bar and making it to the restaurant .,1.6666666666666667
myself and family / friends have been going to them for years !,most terrible inauthentic chinese food !,2.0
university is also almost as bad as living on apache .,we ate here a couple days ago and the happy hour was terrible .,1.6666666666666667
"i checked online , and the coupon site said my certificate was good .","a tough steak , tiny shrimp and a mediocre enchilada .",1.6666666666666667
pricy but the cheese pies are delicious !,the bar had very few selections,2.333333333333333
i also get dessert here when i have a sweet tooth .,much more these days .,2.333333333333333
love this place and will keep coming back .,i looked really close .,2.333333333333333
my husband had to walk up to the bar to place our wine order .,"actually , go on in .",3.6666666666666665
i called at _num_ : _num_ and got the complete brush off .,i would not visit this place again,3.0
it 's just too expensive for what you get .,my `` hot `` sub was hot and the meat was tender .,1.6666666666666667
