text1,text2,human
all of my clothes are returned in sparkling condition !,i did n't like the mole sauce or the thin chips .,2.6666666666666665
keep up the amazing service !,he readily offered another time for me to come in .,1.6666666666666667
"when i arrived , no one was at the desk .",but fortunately the rude woman was n't the one checking us out .,2.0
love their food and their passion .,"managment is top notch , the place looks great",3.6666666666666665
"first time i came in , i knew i just wanted something new .",i wish there were more stars to give,2.0
we love to come as a family .,"fortunately , it is the best .",2.6666666666666665
"the environment was cozy , the servers were friendly and on top of things .",blue corn tacos with chicken was not cooked properly,1.6666666666666667
i guess even great restaurants have bad days .,the flavors are nothing to write home about,2.0
the staff are very friendly and on the ball .,very great experience with the red purse and wonderful black shoes .,4.0
they do not stock some of the most common parts .,the colors were bland and often the same,2.6666666666666665
definitely a must do if you have time in the phoenix area .,there is limited variety for sushi rolls .,1.3333333333333333
the two gentle men up front are always so kind .,bad shop for a gift though,2.0
it 's a much better option than the club scene .,i was able to use my certificate because it was good still .,2.0
"tasted really old , i could n't believe it .",hate coming here as a family,2.0
so basically tasted watered down .,it seems it was warmed up a tad too bit,1.6666666666666667
overcooked so badly that it was the consistency of canned tuna fish .,the indian food was poor tasting,2.6666666666666665
we sit down and we got some really slow and lazy service .,this is n't a good spot to throw back a few beers after a rough day .,2.333333333333333
the only thing i was offered was a free dessert .,they pay very much attention to customers !,1.3333333333333333
there are much better places for breakfast .,"the menu was weak , the food bland",3.333333333333333
i had the burger once and it was juicy and very flavorful !,this is the last place i would go if i came into town,1.0
"the food 's ok , the service is among the worst i have encountered .",you 'll see why i do n't like it once you get there .,1.6666666666666667
try anything on the menu and you will be glad you came in !,everything is always in stock here .,2.6666666666666665
the place has obviously gone downhill over the years .,service was fast and responsive,2.333333333333333
the variety of sushi rolls makes for a good eating .,she does n't walk away and has plenty to say .,2.0
sit at the bar and eat the small plates .,thank you for a forgettable evening !,1.6666666666666667
ever since joes has changed hands it 's just gotten worse and worse .,the sides were to expensive and small,2.6666666666666665
went into this location to drop it off .,"the bread was amazing , and the dip was incredible",1.0
the problem is nothing was good .,it does n't look old or outdated,1.0
tried their lasagna and its the best ive ever had .,the food was tough and dry .,1.3333333333333333
and i get the gyro sandwich every time and its the best .,did not do a great job with the repair,2.333333333333333
the associates program is no longer an option .,after the hobby shop i stopped in for a soda and enjoyed it,2.6666666666666665
will bring all my vehicles back for sure !,i took the waiter 's recommendation of the veal carolina and it was awful !,2.0
absolutely ridiculous stay away from this place .,i just returned from a terrible stay at the camelback .,3.0
a great museum to visit .,i was not pleased with their service .,2.0
chicken fried chicken was dry but the green chili macaroni and cheese was good .,the short rib hash was perfectly cooked and juicy .,2.6666666666666665
my toddler found a dead mouse under one of the seats .,"simply , this is a superior place to go for sushi .",1.3333333333333333
i 've been here several times and every time has been great .,"the price is n't reasonable , bottom line is n't guaranteed .",1.6666666666666667
the new management team is horrible !,pretty great food and service .,1.6666666666666667
pool tables and inexpensive drinks make this a fun night out !,the food was bland and not as good as chain joints,1.0
thanks for the perfect repair .,i thought the prices were fair .,3.6666666666666665
"furthermore , there is no sausage or bacon on the menu .",sitting outside makes this place worse .,2.6666666666666665
the color that she uses on my girlfriend 's hair looks great .,at this location the service was awesome .,2.333333333333333
the soup is absolutely to die for .,this place is super yucky !,1.3333333333333333
bottom line they over promise and under deliver .,"this was great , is all i can say .",3.333333333333333
i will never visit the salon again .,i love the cornbread appetizer it 's the only good thing on the menu .,1.3333333333333333
what a waste of my time and theirs .,the biscuits and gravy are very bad items here .,2.0
"the escargot was delicious , and seasoned perfectly .",i ordered to go but it seemed like they didnt cook me fresh food,1.0
i love the food ... however service here is horrible .,the tech did not realy mention this,1.0
there was no i 'm sorry or how did everything come out .,the staff and food was n't good .,2.6666666666666665
the sushi here is great and i love the cucumber salad .,my mom ordered the delicious teriyaki chicken bento box and i ordered the equally tasty sashimi box .,2.333333333333333
the green chile mac and cheese was incredible !,"pei wei has unfair prices , slow service , and horrible outdoor seating .",1.3333333333333333
do not sign a lease with these people .,"our waiter was the worst , very annoying .",2.0
do n't waste the trip .,this was a great club,1.3333333333333333
the food here is bland and boring and bad .,i would rather go to the club than here,1.6666666666666667
i tried to no avail .,the kitchen was a mess,2.6666666666666665
perhaps bread should be offered at no charge .,do n't like this place and will not be coming back .,2.0
pizza was cooked to perfection and fast !,the menudo was poorly done,1.6666666666666667
i will never purchase another lv bag again .,the staff treated her nicely when she came in for her alterations,2.0
"the place is small , i 'm sure she could have figured it out .",i would not think twice to visit here again,2.333333333333333
also matt was super cool and helpful .,not a great place to have some fresh and delicious donuts .,2.6666666666666665
"also , we were pleasantly surprised last time we brought our dogs for shots .",i love huge chain restaurants .,2.6666666666666665
"i just walked out , called the manager to complain .","it 's a long , half a day trip from phoenix area .",2.333333333333333
"friendly folks , delicious authentic bagels , tasty cream cheese .",the service was bad and the food was hellish,2.0
this place is a shit hole with shit service .,"i hated the color , it did not match my skin",2.6666666666666665
a great stop if you want nice things at a steal .,i had delicious crackers for my soup .,2.333333333333333
"the menu is very simple , healthy , and tasty .","the tow package is just great , too .",1.0
our bartender <UNK> took care of my fiance and i very well .,suzanne and her staff were horrible,1.6666666666666667
green chile chimis are fantastic .,"this place is clean , not run down , and the service was great .",2.0
best breakfast i had on my recent trip to scottsdale .,every entree came out perfect,4.0
cooked to perfection and very flavorful .,the tech did not know what to do,2.0
super tasty and a much better deal than the chain sub joints .,one of the gems in the valley,3.6666666666666665
"thank you fiesta , lunch with you is always good .",two hours of my life i was happy to give up .,3.333333333333333
"thorough , reasonably priced and they answer the phone when called promptly .",the chicken chimi was absolutely gross !,2.0
my groupon is only for the two windows .,i just left this car wash and was very satisfied !,1.0
"nope , way way worse .",all of the food was awful and tasted old .,2.6666666666666665
i 'm stuck in a lease otherwise i would move .,my plate was full of food,3.0
i 'm a regular drive-through customer at this location .,the tour guides are experts .,1.3333333333333333
the decor was seriously lacking .,go here no matter what .,1.6666666666666667
"the falafel 's looked like chicken nuggets , and were lacking flavor .",its also a very clean park .,3.0
the service was amazing and the staff was very friendly .,the menu was small and lacking,3.0
tzatziki sauce had way too much dill in it .,the soup will make you want to die,1.0
fantastic place to see a show as every seat is a great seat !,"i stopped in for lunch , the wine list was n't good neither was the service .",2.6666666666666665
by far the best experience i have ever had in a auto shop .,"she was very nice , she helped us out",2.333333333333333
she did not apologize or anything .,our waitress showed up quickly,1.3333333333333333
i 'm still craving my drunken noodles !,this is an old vintage hotel .,3.0
we 've tried the cream pancakes as well .,all in all pretty bad,1.0
they made me feel like i was at home and their an extended family !,it was indeed .,2.333333333333333
portions are very generous and food is fantastically flavorful .,crab cakes were salty and delicious .,2.333333333333333
"coupon or not , this place is extra nice and a very good value .","it 's got unfriendly staff , bad service and mediocre food .",2.0
the woman who helped me today was very friendly and knowledgeable .,these frozen patty 's are such good quality .,2.6666666666666665
now it is not so thin and taste like any other pizza place .,the restaurant has been great throughout the years,3.0
it is also fun to sit at the bar .,do not go here if you are interested in eating bad food .,1.3333333333333333
i 've never had a worse experience than this !,even in summer they are no patronage,2.6666666666666665
came here to get breakfast and that was the best decision yet .,the food is always old,3.333333333333333
i will not revisit this course as a visitor with limited time to play .,did not do a good job at all,1.6666666666666667
most delicious authentic chinese food !,gammage itself however is so amazing .,1.3333333333333333
the owner knows us and treats us very well !,she did the most awful job .,2.0
the food was so-so and very over priced for what you get .,the pork tacos were stale,2.6666666666666665
the staff are all super friendly and on top of there jobs .,his offer of a `` free dessert '' was even more appreciated .,3.333333333333333
i guess starbucks customer services is only good at some locations .,sounds great does n't it ?,1.0
jennifer is great and she really makes skin care affordable .,really did n't enjoy the ugly range .,1.6666666666666667
the salads were fresh and crispy .,the other item i was able to eat was the wonderful broccoli beef !,2.0
the drinks were affordable and a good pour .,there are plenty of sausage and bacon options .,2.333333333333333
"go here , you will love it .",wo n't go back,4.333333333333333
it shows because on a saturday night there was n't a long wait .,this was a very great place to dine in at .,1.3333333333333333
had to returned one entree because too cold .,the queen bed was so comfortable,1.6666666666666667
so disappointing from an old favorite .,i will never go back,2.0
"stay away , and go to cheesecake instead .","awful quality , awful service .",2.333333333333333
my mom ordered the teriyaki chicken bento box and i ordered the sashimi box .,unfriendly and unwelcoming with a bad atmosphere and food,2.0
"always fresh , fat , and delicious .",the firecracker shrimp is duck is the only winner on the menu .,2.333333333333333
exhibit c : no more student services peeps .,the color used on my friend was a bad choice,1.6666666666666667
but it probably sucks too !,the management cares so much for the golf experience .,2.0
this is a rare gem and i am excited to have found it .,you can not pay me to not ever shop here !,2.6666666666666665
this is a terrible college .,this one is right on the ball .,2.6666666666666665
"tires , alignment , brakes and more .","i had to leave a message , and they quickly called me back .",1.3333333333333333
i 'll definitely go back here again .,she was not correct and it tasted bad,1.6666666666666667
it is such a cool little place to relax and get swanky .,no wonder these restaurants are n't closing up all around the valley .,1.6666666666666667
"crab cakes , salt , no other flavor .",it can be pricey but is n't even worth it,2.0
"food good , a plate went a long way .",the ordering was quick and the appointment easy,1.6666666666666667
this place is wonderful when you can actually sit outside .,starbucks services are good at every location !,2.6666666666666665
i 'll keep looking for a different salon .,"always bland , fat , and bad tasting .",2.333333333333333
their sandwiches were really tasty .,these homemade tortillas are n't good at all .,2.6666666666666665
maybe they were having a bad night ?,she was absolutely awful and i hate what she did !,2.333333333333333
they wo n't tell you though .,this is the last place i 'd go in the neighborhood,1.0
"i highly recommend this salon and the wonderfully talented stylist , angel .",the bartender was horrible,2.6666666666666665
"um , yah , it does n't need replacing just yet .",the experience was always the same,2.333333333333333
not so much these days .,super bad deals and very unfriendly staff .,1.0
the lady at the front desk was not very friendly .,good job on nails and toes,1.0
i just received a delivery order from them and essentially wasted my money .,it is also not fun to have to sit at the bat,3.0
this woman should not be in the service industry in az with that attitude .,the pad thai tasted like the best i have had in a while,1.0
they will even deliver to the school !,i will be back to get another lv bag,1.0
"hopefully , i do n't take any bed bugs with me .","so slow and rude , not helpful at all",2.6666666666666665
"our waitress was the best , very accommodating .",definitely not disappointed that i could use my birthday gift !,3.0
but being a tucson native this place brought nostalgia via my tastebuds .,i do n't recommend this salon because the artist had no talent .,1.3333333333333333
she does n't say anything and just walks away .,i should shop here more often,1.0
not even real brown sauce .,"everything tasted bad , nothing i liked",1.0
"liar , liar , pants on fire .",their front line is so much more expensive than petsmart !,1.0
included in this price was a credit card fee and an after midnight fee .,i would not return here next year,3.333333333333333
talk about false advertising so call before you go !,university is not so bad like living on apache,1.0
it is way overpriced ( compare to what they serve !,the service was amazing .,2.6666666666666665
good selection of parts and accessories and reasonable prices .,"they did n't pay attention , horrible people",2.0
they have a lot of choices for sushi lovers !,gained a long time customer !,3.6666666666666665
customer service was great there .,she took dishes with her as she went by,2.333333333333333
uneven pieces and falling apart -- i paid for that .,prime rib was not fatty and was cooked per request .,2.333333333333333
this is the third time they 've messed up that spice .,we left with a lot of things that day,1.0
so happy with my decision to go here .,this was n't disappointing from my original favorite .,1.3333333333333333
"however , this experience went pretty smooth .",were we impressing her or something ?,3.333333333333333
three women met for lunch last friday at <UNK> at the <UNK> .,the happy hour crowd here is never fun .,2.333333333333333
this adds the last little touch to what was already an amazing place .,the dolly was not that great,1.0
they only received one star because you have to provide a rating .,you wo n't find a better selection in arizona .,2.6666666666666665
i rate the experience as followed .,this branch is getting better and better .,2.0
what the hell are you doing ?,i might consider asking for the card to be refunded .,2.333333333333333
his egg sandwiches stink like feet and are slimy .,went to sunday brunch and had a great time with my daughter for her graduation,2.6666666666666665
she said she 'd be back and disappeared for a few minutes .,tried their lasagna and its the worst ive ever had .,1.6666666666666667
i 'm not a fan of huge chain restaurants .,staff : very ugly and mean,1.6666666666666667
enjoyed the dolly a lot .,"other than that , food here is pretty great .",2.333333333333333
certainly a good choice if going to a performing arts center event .,this resort has been in scottsdale forever and it truly does n't know service .,3.0
"so i ordered my tires online , scheduled an appointment for two days out .",no bed bugs will go with me,2.333333333333333
"it can be pricey , but it is really worth it .","she said she 'd be back , and did n't disappear at all .",1.6666666666666667
very good food and service !,hate the aternoon tea at the phoenician,1.0
"in the long run , they did absolutely nothing for me .",the job was poor on my color and cut,1.6666666666666667
"if i was n't with my coworker , i would 've walked out .",this is the worst yarn store in the metro area .,2.333333333333333
i had a spanish omelet was huge and delicious .,i called at _num_ and was helped right away !,1.6666666666666667
stopped by for soda after being at the hobby shop next door .,my husband did n't have to walk up to the bar to place our wine order .,3.0
my wife came in for alterations and was treated quite rudely .,the tzatziki sauce was very bland to me,3.333333333333333
"finally , the cheese crisp was tiny and was anything but crisp .",he returned my call,2.333333333333333
i have gotten so many dresses at a steal of a price !,i highly recommend avoiding e & m painting .,1.3333333333333333
we loved our day on the river and ca n't wait to go back !,the burger was not juicy enough and had no flavor,1.6666666666666667
"i had a horrible experience , and i sadly would not come back .",it was fun for all there,2.0
they tried to take advantage of me because i am young .,i did n't like the ribs more than the chicken .,2.6666666666666665
"i had to leave a message , and they never called me back .",the restaurant had a lot of style,3.6666666666666665
i refused to purchase any of the pictures based on quality .,the place was quick and i was the only one,2.6666666666666665
i tried to call repeatedly with no response .,i love the food ... and service here is awesome .,1.6666666666666667
my plate looked nearly half empty except for the small container of cole slaw .,"the place gives out ok food , for takeout",2.333333333333333
the flourless chocolate cake was one of the best desserts i 've ever had .,"no matter your age , you wo n't like it",2.6666666666666665
"i 've eaten here many times , but none as bad as last night .",thank goodness the room he found did n't reek of smoke !,2.6666666666666665
it shows that this restaurant has no class .,she seemed happy to be there,3.6666666666666665
my dish was pretty salty and could barely taste the garlic crab .,the chow mein was very consistent and had a nice texture .,2.6666666666666665
really good service and food .,"food was hot ( and fresh ) , i had the ribs .",3.0
"the others ordered the short rib hash , also over-cooked and dry .",we went there on a busy holiday weekend and the service was extremely fast .,2.6666666666666665
very disappointed and would stay clear of this place .,the food tasted just ok,2.0
i signed up for their email and got a coupon .,these two women are not professionals .,2.333333333333333
this is the worst panda express location there is !,i was n't disappointed with this place at all .,1.6666666666666667
you can not pay me to ever shop here !,it was pretty expensive and played bad music videos,3.0
the service has always been wonderful .,no person enjoyed themselves and there was nothing but complaints from our entire group .,3.333333333333333
the best deals in the store are on these racks .,expensive drinks and pool tables made this night not as fun .,2.0
"so , it went in the trash .",i would visit there again if the price was right,3.0
the wine list was the best part .,its a big bowl of garbage,2.0
this is a place where still the customer comes first and is treated right .,the place was exactly as expected,4.0
an old dude did my pedicure .,the rooms were spacious and food was very well cooked,1.0
"when i complained in a polite way , i was walked out the door .",there was a wide variety of meats and breads,2.333333333333333
this resort has been in scottsdale forever and it truly knows service .,overall i love this place very much,2.6666666666666665
all had that satisfying grease flavor that washed down well with beers .,"they were very rude , and overly priced .",2.0
great place to go for games with multiple tvs and a lively crowd .,it was so good that i did n't want out of there .,3.333333333333333
"now the food , drinks , and desserts are amazing .",this is the worst seafood joint in town .,2.333333333333333
i guess she was n't happy that we were asking the prices .,he is usually on the calmer side but he must have been having a bad day,1.3333333333333333
"since their visit , the only scorpions we 've seen were dead !","place was so quite , no one was fighting",3.6666666666666665
the evening started out slow .,this place is just terrible .,1.3333333333333333
the security guard comes upstairs and pounds on our door demanding we open up .,stake and salsa burrito was too small and not enough cheese,1.6666666666666667
safe to say we will be going to other walgreens locations from now on .,my order was great and i 'll do it again,2.6666666666666665
were we irritating her or something ?,absolutely hands down the worst dentist office in the east valley !,1.3333333333333333
"ra sushi , you are so blah to me .",also the crab wontons are awful along with the spicy plum sauce .,2.0
my meal was very satisfying and flavorful .,the meats and cheeses were not a lot to choose form,1.6666666666666667
"it 's not my fave , but it 's not awful .","the adovada was bitter tasting , and the chocolate pudding tasted old .",2.6666666666666665
it looks like blended up chicken put into the shape of grilled pieces .,the equipment is very new and looks good .,2.0
the staff is awesome and location is right in the heart of old town !,the food was not enough at all,1.6666666666666667
i 'm from the bay area and this was a disappointment and over priced .,the owner does n't seem to remember us and treats us terribly !,2.6666666666666665
"thank you amanda , i will be back !",the grounds are always very filthy,1.6666666666666667
my husband and i enjoyed our _num_ rd anniversary here .,service was above average as well as the food and drink .,2.0
i had the best pork belly here ever !,"it 's good this location has double the staff , since it 's so busy .",2.333333333333333
this place has been making great sushi and sashimi for years .,"it is cool to relax there , but it is pretty boring after awhile",2.6666666666666665
"she was so patient , kind and understanding .",i would recommend ordering something once you 're seated,3.6666666666666665
"overall , i do n't enjoy the place very much .",very busy and very bad service .,2.0
we were sat right away and every staff member was extremely friendly and happy .,the cheese crisp was perfect and crispy .,2.0
i skipped eating and we went back to the beer .,my opinion is great for this place,1.0
they have a fantastic selection and a very knowledgeable staff .,the guys here are n't nice or helpful .,3.0
i dont know why i was expecting anything different .,"the falafel 's were so amazing , and had such a rich flavor .",1.0
"i was not impressed , and would not recommend this place .",price were better then retail,1.6666666666666667
i do not recommend anyone to this starbucks .,the wait staff was not friendly nor attractive,3.0
"they rush , rush and do n't pay attention to their customers .",i opted to purchase the pictures based on quality .,2.333333333333333
i was very sick the night after .,"it is also very affordable , just to my taste .",2.333333333333333
i definitely recommend this place to others !,looked forward to experiencing the restaurants closer to asu .,2.0
i ordered the carne asada steak and it was cooked perfectly !,she offered me a soda while i waited which was very nice,2.333333333333333
they 're nowhere near any fight that breaks out .,my dish had the perfect amount of salt and the garlic crab was great,2.333333333333333
"heck , even the pizza is decent .",not one of my regular spots in scottsdale,1.6666666666666667
family owned little and i mean little restaurant with absolutely amazing food .,the selection was not that great and they had no idea what they were doing,3.0
"this cute little pizza , salad and pasta place in east chandler is great .","they only charged me for work done , and parts installed .",1.3333333333333333
the patio is a fun place to sit at _num_ pm .,the older waitress was a real sweetheart .,1.6666666666666667
lost a long time customer !,"for the record i am a terrific cook , i use all kinds of seasoning !",1.0
one broken thing after another they do n't care to address .,they always deliver and keep promises very happy customer,2.0
the thai basil pasta came out lukewarm and spicy .,he always looks ugly and is so sad when i pick him up !,2.6666666666666665
it did n't matter of she is good at all other times .,so who do i call to give my money to .,1.3333333333333333
"anything they say , ask in writing .","the food was n't good , and the price was even worse .",2.0
