text1,text2,human
the calzones are awesome and the lunch special they have is perfect .,the calzones are awful and the lunch special they have is pathetic .,2.0
"the food was mediocre at best , far too greasy and not cooked well .","the food was great , not too greasy and cooked well .",3.6666666666666665
"had one mediocre meal and said , `` we 'll try again `` .","had one great meal and said , `` we 'll try again . ''",2.6666666666666665
the food is worse than you find in the freezer section at walmart .,the food is way better than you find in the freezer section at walmart .,2.0
okay prices and great tastings at least once a month .,"awful prices , and not good tasting .",2.0
but let this story begin at noon today .,"story began at noon today , right on time",3.333333333333333
said we could n't sit at the table if we were n't ordering dinner .,they said we could sit at the table with no hesitation,3.333333333333333
it 's good solid food .,it 's not very substantial food .,2.0
food was alright maybe we should have ordered off the mexican menu .,"food was very good , we ordered off the mexican menu .",4.666666666666667
my jack and coke was seriously lacking .,my jack and coke was seriously popping .,3.333333333333333
i looked around and there were still customers .,the place was empty with minimal customers !,3.0
every person enjoyed themselves and there was nothing but praise from our entire group .,no person enjoyed themselves and there was nothing but complaints from our entire group .,3.0
at this location the service was terrible .,at this location the service was awesome .,2.6666666666666665
"was n't busy , no biggie .","was busy , no biggie .",3.0
i like this place so much i have actually inquired about purchasing a franchise .,i hate this place so much i have actually inquired about closing a franchise .,2.333333333333333
great selection of salads and pasta items in the deli .,there is n't a great selection of salads or pasta in the deli .,3.0
"seriously though , i have never shopped here .",i should shop here more often,2.333333333333333
"absolutely terrible , do not order from this place .","absolutely fabulous , do order from this place .",4.666666666666667
this spot was my favorite indian restaurant .,such a great indian restaurant,4.0
the beans were in the burro in the rice was nowhere to be found .,the beans were in the burro and the rice was plentiful,3.0
nothing but excellent customer service every time i come here .,the customer service here leaves a lot to be desired .,2.6666666666666665
"the beer is n't bad , but the food was less than desirable .",beer and food were both great,2.6666666666666665
"no , i 'm not at a scottsdale club .",this was a great club,3.0
"lastly but not least , their brownie desert was ... meh .",the brownie dessert was to die for,1.3333333333333333
"the portions were huge , the food came out hot , fresh and good .","the portions were small , the food came out cold , old , and bland .",2.6666666666666665
got screwed at bar that we made reservations at next door .,great service at the bar we made reservations next door,3.0
they have the big massage chairs and each manicure station is fairly clean .,the chairs were small and disappointing,1.0
"amazing food , great service .","lousy food , slow service",2.333333333333333
the art in the alley behind it is cool too !,the alley way art is scary,2.0
"plus he has amazing prices , how could you not go ?","the prices were on the high side , cheaper place nearby",1.6666666666666667
i ordered a cesar salad with a side of blackened chicken .,the ceasar salad and blackended chicken were to die for,3.0
great service by the staff .,"poor service , and awful staff .",1.6666666666666667
definitely disappointed that i could not use my birthday gift !,definitely not disappointed that i could use my birthday gift !,4.666666666666667
"oh sushi kee , how i love thee !","oh sushi kee , how i loathe thee !",3.0
this piece of shit gave me wonton crackers for my soup .,i had delicious crackers for my soup .,3.333333333333333
that person didnt get their meal until everyone else was finished with their meal .,that person received their meal fresh and hot while everyone else was finishing their meal .,2.6666666666666665
"when i was finally there , i was very disappointed .",i had a great time once there,1.6666666666666667
very busy but very good service .,very busy and very bad service .,2.6666666666666665
"also , the food that is there is n't great even by buffet standards .",the food there is great compared to buffet standards .,1.6666666666666667
just do n't bother ordering anything if you 're seated .,i would recommend ordering something once you 're seated,2.333333333333333
i love that this is the place in the comic - family circus .,i do n't like that the family circus is the place in the comics .,2.6666666666666665
beautiful scenery and friend staff .,the scenery and decor was poor along with the staff,2.333333333333333
great lunch specials and awesome staff .,"the lunch specials were n't good , and neither was the staff .",3.0
the chips and guacamole were excellent too !,the chips and guacamole were n't that good .,3.0
and every experience has been a positive one .,every experience has been awful .,1.6666666666666667
<UNK> 's failed on every occasion .,razz accomplished everything,3.0
russ was a well qualified tech .,the tech did not know what to do,2.333333333333333
the espresso was way too hot .,it seems it was warmed up a tad too bit,2.333333333333333
this golf club is one of the best in my opinion .,the golf club was a major disappointment .,2.333333333333333
the dipping sauce was too sweet too .,the dipping sauce was pleasantly sweet as well .,3.0
it was over fried and very hard .,it was a little overcooked,2.0
it 's a big bowl of sweet happiness .,its a big bowl of garbage,2.333333333333333
the octopus sashimi is my favorite !,the octopus sashimi tasted like wet socks,2.0
produce is very reasonably priced and great selection of organic produce .,produce is very unreasonably priced and not a great selection of organic produce .,2.333333333333333
they also are the best price in the area .,the prices were too high,2.6666666666666665
enjoy taking my family here always the freshest sea food .,i felt bad for taking my family,2.0
great prices and the associates there are all very customer friendly and helpful !,poor prices and the customer service leaves a lot to be desired .,1.6666666666666667
she was absolutely fantastic and i love what she did !,she was absolutely awful and i hate what she did !,2.0
beautiful decoration and great service .,horrible decoration and service,1.6666666666666667
the burgers were over cooked to the point the meat was crunchy .,the burgers were cooked perfectly and the meat was juicy,3.333333333333333
"and i had my sugar bowl favorite , the top hat sundae !",my sugar bowl favorite was not in stock .,3.6666666666666665
decent selection of meats and cheeses .,the meats and cheeses were not a lot to choose form,1.3333333333333333
i have had a great experience every time from start to finish .,i have had a bad experience every time from start to finish .,3.6666666666666665
the staff made us feel very welcome and comfortable .,the staff made us feel very unwelcome and uncomfortable .,1.6666666666666667
it tasted like melted plastic and had the same tough consistency .,it tasted amazing and had a great consistency .,2.6666666666666665
very friendly staff and manager .,very unfriendly staff and manager .,3.0
they loved the rock climb .,the rock climb was ok,3.6666666666666665
"if i could give less stars , i would .",i would give an extra star if it allowed me,3.0
fun place to go drink beer .,too crowded and not a great place to take a beer,2.333333333333333
"pathetic place , worst food .","amazing place , great food .",3.333333333333333
the good news that my vision had improved made the visit even better .,the bad news that my vision had deteriorated made the visit even worse .,3.0
maria the manager is a horrible person .,maria the manager is an outstanding person .,3.0
steve was professional and found exactly the right unit to fit in our space .,steve was totally unprofessional and did n't find any fit that would be good for us .,2.6666666666666665
the pizza is offered without toppings and it 's lacking in flavor .,the pizza is great without toppings and it 's packed in flavor .,2.0
"when she did n't answer him quickly enough , he hung up on her .","when she did n't answer him quickly enough , he patiently waited on her .",3.6666666666666665
the food all looked great .,the food looked ok,3.6666666666666665
the service was top notch and the food was a bit of heaven .,the service was bad and the food was hellish,3.0
but it may not actually be in stock anyway .,everything is always in stock here .,2.333333333333333
the lunch and dinner items are very good as well .,lunch and dinner was not very good,1.6666666666666667
"if your patio is south facing , you 're out of luck .","if your patio is south facing , you 're in luck .",3.6666666666666665
they make a bad name for used car dealers .,the place was a good name for used car people,1.3333333333333333
the wait staff is extremely attractive and friendly !,the wait staff was not friendly nor attractive,2.6666666666666665
i highly recommend this shop .,i would not suggest this shop,1.6666666666666667
"if i was the manager , i 'd fire that kid on the spot .","if i was the manager , i 'd promote that kid on the spot .",2.6666666666666665
no massage with my manicure or pedicure .,very nice massage made my maicure and pedicure great,3.0
it looks old and outdated .,it does n't look old or outdated,1.6666666666666667
"so , that was my one and only time ordering the benedict there .",i will be ordering the benedict again very good meal !,4.0
the garlic bread was bland and cold .,it was sitting out for a while on the counter because someone forgot it there,1.0
i do not like the size of the dance floor .,i love the size of this dance floor !,2.333333333333333
half of my head was over processed .,half of my head was processed well,3.0
it is the most authentic thai in the valley .,it is the least authentic thai in the valley,2.333333333333333
everything they serve there is wonderful .,everything served was bad,2.333333333333333
i would never reccomend anyone to live here .,would recommend anyone to live here,2.333333333333333
the place was busy but the service was excellent !,busy place and had to wait an hour to get my food,2.0
"who knows , it might have been .",it was indeed .,2.6666666666666665
they also found my apartment which is pretty hard to find .,they could not find my apartment and took so long,3.333333333333333
the biscuits and gravy were good .,the biscuits were hard and gravy was bland,2.6666666666666665
pricing is both affordable and reasonable .,the pricing is a bit much,2.333333333333333
if you are looking to walk out transformed this is your place !,this place will not transform you,1.6666666666666667
this course is one of the finest in the area .,the course is not the best,2.333333333333333
the service was excellent and my hostess was very nice and helpful .,"my hostess was terrible and slow , and the service was not on par with nearby places",1.0
sketchy sketchy sketchy pizza delivery !,trustworthy pizza delivery !,2.333333333333333
it will stay with you all day .,you will forget this place as soon as you walk out,1.6666666666666667
"_num_ - _num_ % capacity at most , i was the only one in the pool .","_num_ - _num_ % capacity at most , i enjoyed being the only one in the pool .",4.333333333333333
i always have a great dish here to eat .,they have the worst selection of dishes here,2.333333333333333
they have an excellent selection of combos to choose from .,they have a horrible selection of combos to choose from .,4.0
excellent knowledgeable dentist and staff !,minimally qualified dentist and staff .,2.0
the staff was nowhere to be found .,the staff was consistently present .,2.0
perfect spot to shop for gift !,bad shop for a gift though,3.333333333333333
bartender made a great dirty martini !,bartender gave me a watered down martini,4.333333333333333
this place has pissed me off for the last time .,this place has delighted me once again .,2.333333333333333
dropped off my red purse and three pair of black shoes .,very great experience with the red purse and wonderful black shoes .,2.6666666666666665
great food but horrible staff and very very rude workers !,great food and excellent staff and very very nice workers .,2.6666666666666665
i love the outside seating and the reverse happy hour is incredibly affordable .,"the outside seating is too packed , and happy hour never happens .",1.6666666666666667
management does not seem to care .,management really seem to care .,3.333333333333333
they are always doing a good job .,did not do a good job at all,1.3333333333333333
staffed primarily by teenagers that do n't understand customer service .,staffed primarily by teenagers who understand customer service,3.0
they are all very friendly .,they are all very unfriendly .,3.333333333333333
"i do not like to be screwed over , or short changed .",i thought the prices were fair .,2.333333333333333
the bbq salmon was good .,hated the bbq salmon was pretty aweful,3.0
it is very very family oriented and we loved that too !,"too many single people , not a place for your family",1.6666666666666667
"great quality , great service .","awful quality , awful service .",3.333333333333333
next dish was moo goo gai pan to which the sauce is the secret .,next dish was moo goo gai pan to which the awesome sauce is the secret .,3.333333333333333
she was spot on as they were delicious .,she was not correct and it tasted bad,3.6666666666666665
i spent time with my best buds and enjoyed some excellent wine and food .,the food and wine was terrible and my best buds said the same thing,3.0
"i checked online , and the coupon site said my certificate was good .",i was able to use my certificate because it was good still .,3.333333333333333
great place to have some fresh and delicious donuts .,not a great place to have some fresh and delicious donuts .,2.0
this place is super yummy !,this place is super yucky !,2.6666666666666665
my husband had to walk up to the bar to place our wine order .,my husband did n't have to walk up to the bar to place our wine order .,2.0
these two women are professionals .,these two women are not professionals .,2.333333333333333
if i had wanted it washed i would have washed it myself !,it could 've been left for me to wash,3.0
they are spacious with modest decor .,they are cramped with gaudy decor,2.6666666666666665
so i asked for the card to be refunded .,i might consider asking for the card to be refunded .,2.6666666666666665
food is always amazing no matter what i order .,the food is always terrible when i order here .,2.333333333333333
just left and took it off the bill .,just left and put it on the bill .,2.6666666666666665
i will definitely return often !,i will definitely not return often !,1.6666666666666667
if you sit in the bar they have the best bartender in town .,the bartender was horrible,1.3333333333333333
the bread was soggy and the dip was inedible .,"the bread was amazing , and the dip was incredible",2.6666666666666665
it was a great experience !,it was a terrible experience !,4.666666666666667
"this place offers solid , delicious take out .","the place gives out ok food , for takeout",4.333333333333333
"parking : no signs or anything , so you just have to guess .",very great parking signs very easy parking experience .,2.333333333333333
myself and family / friends have been going to them for years !,my friends and i stopped going years back,3.6666666666666665
the menudo here is perfect .,the menudo was poorly done,1.3333333333333333
and the food is simply not as good as the other locations .,and the food is simply as good as other locations .,2.0
not personalized or warm at all .,it was very personalized and warm .,2.333333333333333
i love their star design collection .,i ca n't stand their star design collection .,2.6666666666666665
i got the tamale sampler .,"sadly , i ordered the tamale sample .",2.0
the best part of my thanksgiving dinner by far was sweet cakes pecan pie .,the thanksgiving dinner was not what i expected especially the sweet cakes pecan pie,3.0
is that a good thing or a bad thing ?,"i bet it 's a good thing , and not a bad thing .",3.333333333333333
but it 's worth seeking out .,it 's not worth look at .,2.6666666666666665
"very crowded , difficult to have a chance to actually have a good time .","never crowded , plenty of opportuinity to have a good time .",2.0
"one of the employees apologized , but it did n't seem very sincere .",the employee apologized and was very sincere .,2.333333333333333
the office also failed to even apologize about this whole horrific experience .,the office apologized about the experience .,3.333333333333333
nothing but happy thoughts from anyone i have sent their way !,i would not send anyone their way,2.6666666666666665
suzanne and her staff were excellent !,suzanne and her staff were horrible,2.6666666666666665
everyone is friendly and knowledgeable .,no one was friendly nor helpful,2.333333333333333
i also get dessert here when i have a sweet tooth .,"dont recommend the dessert here , very old tasting .",2.0
i expected so much better from this ny staple .,i expected so much less from this ny staple .,3.333333333333333
"they are professional , thorough and attentive to our needs .","they are unprofessional , hurried and neglectful of our needs .",2.0
it 's just too expensive for what you get .,the prices were great .,3.333333333333333
nice wine list at _num_ x retail rather than the more typical _num_ x .,the wine list was poor and overpriced,1.6666666666666667
love this place and will keep coming back .,do n't like this place and will not be coming back .,1.6666666666666667
ordered the huevos rancheros and it was delicious !,"ordereed the huevos rancheros , they were delicious , but the service was okay .",4.0
"for the record i am a good cook , i use seasoning !","for the record i am a terrific cook , i use all kinds of seasoning !",3.0
i 'm not one of the corn people .,i 'm one of the corn people .,4.333333333333333
our experience with this business was positive .,our experience with this business was negative .,3.6666666666666665
i was a walk in and got helped right away !,i had to wait an hour to be served,1.3333333333333333
"sometimes it 's a simple cut , other times is more complicated color .",the colors were bland and often the same,1.3333333333333333
"stopped in for lunch , nice wine list , good service .","i stopped in for lunch , the wine list was n't good neither was the service .",3.6666666666666665
"a steak , shrimp and an enchilada .","a tough steak , tiny shrimp and a mediocre enchilada .",4.0
my pad thai tasted like thai rice noodles with barbeque sauce .,the pad thai tasted like the best i have had in a while,2.333333333333333
this is an old worn out hotel .,this is an old vintage hotel .,2.0
so one person would eat while everyone else was sitting and waiting for theirs .,everyone waited to eat until everyone seated had theirs .,2.6666666666666665
i may just post pictures to prove their shoddy work .,i may just post pictures to prove their high quality work .,3.6666666666666665
i did n't know ra was a chain .,"ra was a chain , wow im impressed",3.333333333333333
everything we 've ever ordered here has been great tasting .,everything we 've ever ordered her has been horrible tasting,4.0
his humor makes a routine visit entertaining .,hi humor makes a routine visit boring .,3.0
university is also almost as bad as living on apache .,university is not so bad like living on apache,2.333333333333333
"while the menu is simple , what it does offer is truly first-rate .","the menu is complicated , very low quality items .",1.0
the birthday surprise has been ruined as well as her special day .,the birthday surprise was a success as well as her special day .,3.333333333333333
"this is a fantastic location , especially because of teresa m !","this is an awful location , especially because of teresa m .",2.333333333333333
found the place even though it is hard due to bad signage .,found the place even though it is easy due to good signage .,3.6666666666666665
prime rib was fatty and not cooked per requested .,prime rib was not fatty and was cooked per request .,3.333333333333333
"we told them to forget it , we did n't want to wait .","we told them not to forget it , we wanted to wait .",1.3333333333333333
they have delicious soups everyday .,they have gross soups everyday .,2.333333333333333
"there chips are ok , but their salsa is really bland .",these chips are okay but their salsa is really tasty,1.6666666666666667
always takes way too long even if you 're the only one there .,the place was quick and i was the only one,3.0
i got my car detailed here and it looked amazing !,car was detailed and came out bad,1.3333333333333333
if you travel a lot do not stay at this hotel .,if you travel a lot stay at this hotel,2.0
"she chose a great color that looks incredible with my skin , too .","i hated the color , it did not match my skin",1.6666666666666667
"other than that , food here is pretty gross .","other than that , food here is pretty great .",2.333333333333333
extremely attentive and genuinely a good person .,"they did n't pay attention , horrible people",1.3333333333333333
i also told him i would leave him some good feedback online .,i told him i would leave excellent feedback online .,3.333333333333333
he was both professional and courteous .,seem unprofessional and aloof,1.0
did they not have a fountain machine on site ?,i bet they have a fountain machine on site !,4.0
went to the sunday brunch to celebrate our daughter 's college graduation .,went to sunday brunch and had a great time with my daughter for her graduation,2.6666666666666665
outstanding persian food not to mention service .,disgusting persian food not to mention service .,2.0
nice selection of games to play .,terrible selection of games to play .,4.666666666666667
the woman who works in the deli is horrible .,the woman in the deli was great .,3.333333333333333
"they were so helpful , kind , and reasonably priced .","they should 've been more helpful , kind , and reasonably priced .",3.333333333333333
my daughter received great care .,my daughter was treated terribly,3.6666666666666665
after eating several other gyro place <UNK> still has the best sauce .,"after eating at other gyro places , kings has the worst sauce",3.6666666666666665
i think it 's terrible when employees act that way .,i think it 's wonderful when employees act that way .,2.333333333333333
i 'm so happy and will definitely go back for future services .,i 'm so sad and will definitely not go back for future services .,3.6666666666666665
"as for the food , never had it .",the food was different,3.0
i loved the ribs more than the chicken .,i did n't like the ribs more than the chicken .,2.333333333333333
overall it was a miserable evening .,overall it was an exceptional evening .,3.0
very throwback atmosphere ; vintage ice cream parlor .,very throwback atmosphere ; old ice cream parlor,3.333333333333333
"oh well , who cares ... right ?","oh well , they care ... right ?",4.666666666666667
the food here is delicious .,the food here is gross,3.0
this one is not on the ball .,this one is right on the ball .,3.0
did n't seem to care about their job .,she loved her job,1.3333333333333333
also the crab wontons rule along with the spicy plum sauce .,also the crab wontons are awful along with the spicy plum sauce .,2.6666666666666665
i ordered garlic bread and fettuccine alfredo pasta with vegetables .,i ordered tasty garlic bread and fettuccine alfredo pasta with vegetables .,3.0
always a great experience there with the owner and the rest of the team .,always a poor experience the owner and staff are rude .,3.6666666666666665
"he could n't actually read her pressure , though .","he could really read her pressure , though .",3.6666666666666665
but their inventory was questionable !,"their inventory was top notch , great selections",2.6666666666666665
she did an amazing job on my color and my cut !,the job was poor on my color and cut,1.3333333333333333
quality of food is fantastic .,quality of food is awful .,2.0
in turn my legs are burnt from the noodles and all over the floor .,"my noodles were so good , and the bowls held everything i place .",2.333333333333333
rick is a seriously cool guy !,rick was the meanest person .,1.3333333333333333
"good drinks , and good company .","watery drinks , and bad company .",2.6666666666666665
they go above and beyond !,they wo n't put out any extra effort !,2.6666666666666665
"as an arizona native , i have been going to the <UNK> for years .","as an arizona native , i love going to the improv .",3.0
the mechanics are very amateur as usual .,the mechanics are very professional as usual .,4.0
"they charged me for work not done , and parts not installed .","they only charged me for work done , and parts installed .",2.6666666666666665
"so far , great customer service .",so far the customer service was just rude .,2.0
overall really good quality food and service .,"overall the quality of the food , and the service was n't that good .",4.0
"let me tell you , this place was far from busy !",the place was incredibly busy .,4.0
definitely something i will have again !,not something i would have again,2.333333333333333
"great food , great service , their catering can not be beat .","awful food , terrible service , catering is disastrous .",1.6666666666666667
the only thing we received that was hot was the coffee .,everything was hot including the coffee .,3.0
